PDF Path,Text
1.pdf,"Pristina Airport – Possible administrative irregularity regarding tender procedures involving Vendor 1 and Vendor 2

Allegation

Two companies with the same owner took part at least three times in the same Airport tenders.

Background Information

The Kosovo citizen, Vendor 1 and Vendor 2 Representative, is the owner and Director of the Pristina-based Vendor 1 and also a 51% shareholder of the Pristina-Ljubljana-based company Vendor 2. Both companies have their residences at the same address in Pristina.

Both Vendor 1 and Vendor 2 submitted three times in 2003 for the same tenders:

Supply and Mounting of Sonic System in the Fire Station Building. Winner was Vendor 2 with €1,530 followed by Vendor 1 with €1,620. The third company, Vendor 3, did not provide a price offer.

Cabling of Flat Display Information System (FIDS). Winner was Vendor 1 with €15,919 followed by Vendor 2 with €19,248.70. The other two competitors, Vendor 3 and Vendor 4, offered prices of Euro 19,702 and Euro 21,045.

Purchase and fixing of Cramer Antenna. Winner was again Vendor 1 with €3,627.99 followed by Vendor 2 with €3,921. The other two competitors, Vendor 3 and Vendor 4, offered prices of €4,278 and €4,670."
1.pdf,"Investigative details

In his/her interviews conducted on 31st August and 14th September 2004, Vendor 1 and Vendor 2 Representative admitted that the fact that both Vendor 1 and Vendor 2 took part together in three Airport tenders put other competitors at a disadvantage, but alleged both companies have never exchanged information with regard to the price offers.

There were doubts whether both companies Vendor 3 and Vendor 4 exist and submitted bids for the three tenders. The ITF investigation, with support from the Kosovo Organised Crime Bureau (KOCB), has found no reference with regard to the existence of the alleged competitor Vendor 4 in Pristina. The alleged company Vendor 3 was found to be a supermarket located in Prizren.

The above-mentioned facts are already part of the ITF case no. 286/04 that was submitted to the International Prosecutor, UNMIK Department of Justice, in October 2004. On 1 December 2004, the ITF contacted the International Prosecutor for a legal assessment of this case. Although this case would clearly be a breach of Economic Law, there is no applicable law in Kosovo for the time being."
10.pdf,"""An interoffice memorandum providing an “outstanding issues update to Official 2”, from DOTI Official 3 to Staff member 1 at the office of Official 2 dated 18 May 2001, could give rise to the suggestion that offers were provided by companies on 28 May 2001, and the Vendor had been chosen for the works in advance. However, a more likely explanation is the date of the interoffice memorandum has been incorrectly dated, since the document contains reference dates relating to project “events” which post date 18 May 2001. At paragraph 2b, the interoffice memorandum states that the Cargo Apron invitation to tender was based on summary documents."""
10.pdf,"""Allegation 2 & 3:

(Specifically, three of the persons on the bid opening committee and evaluation committees were the same parties who should not have carried out both tasks.)

and

(The contract for the Cargo Apron Extension was not channeled through the Office of the Legal Adviser.)

The evaluation report dated 2 August 2001 is signed by three parties, who are also listed as having attended the bid opening session. This indicates that the composition of the bid opening committee and the evaluation committee overlapped.

When asked about this issue in interview DOTI Official 2 confirmed that he/she was both on the bid opening committee and was a member of the evaluation committee. He/she added that the people who evaluated the offers signed the evaluation report. This is in conflict with UN regulations, which segregate the two roles. An interoffice memorandum dated 24 September 2001 indicates that the contract for the Cargo Apron Extension had not been channeled through the Office of the Legal Adviser."""
10.pdf,"""When asked about this in interview, the Divisional Manager stated: “Without seeing any other documents, on the face of it, it does appear that there could be a conflict of interest here. But the report was produced by a professional pavement engineer, at a laboratory. Therefore, one can assume a certain degree of integrity.”

The ITF notes that the PEAP Official indicated that he/she was unhappy about the Vendor self-certifying its work and he/she commented that the airport engineer should have questioned it.

The ITF does not have sufficient technical knowledge to assess the adequacy of the Vendor’s work. However, a letter from the Divisional Manager to Staff Member 3 dated 25 August 2002 gives rise to the possibility that it was not up to specification in certain areas."""
10.pdf,"""INVESTIGATION DETAILS

This part of the investigation relates to a tender for a contract for the extension of the Cargo Terminal Apron at Pristina Airport. The value of the contract was €774,318.63.

Allegation 1

(Specifically, the tender documents for the cargo apron did not comply with the requirements of Article 23.4 of the UNMIK Finance Administrative Instruction 1999/2 on Public Procurement using Kosovo Consolidated Budget Funds, as they were based on summary documents and did not include clear instructions on drawings and plans.)

A note from the Project Engineer at the Evaluation Company to the PEAP Official, dated 31 January 2001, indicates that the Evaluation Company was commissioned to produce a preliminary design for the Cargo Terminal at Pristina Airport. The design also provided for the construction of the Cargo Apron Extension."""
10.pdf,"""At paragraph 4 of the Cargo Apron Extension evaluation report dated 2 August 2001, the committee notes that the bidding documents did not include clear instructions on drawing and plans. It therefore was recommended that negotiations be held with the lowest bidder, the Vendor, on further details of the scope of works.

In combination, the two documents suggest that the tender documents did not comply with Article 23.3 of the UNMIK Finance Administrative Instruction 1999/2 on Public Procurement using Kosovo Consolidated Budget Funds.

When asked whether he/she was of the view that the tender documents complied with the provisions of Article 23.3 of the UNMIK Finance Administrative Instruction 1999/2 on Public Procurement using Kosovo Consolidated Budget Funds, DOTI Official 2 conceded that if an engineer was asked this question, he/she would indicate that the tender specifications were technically deficient and did not comply with Article 23.3."""
10.pdf,"""Until the end of June 2002, responsibility for the administration of the Pristina Airport was entrusted to the Civil Administration Pillar (Pillar II) of UNMIK, including Official 1 and Official 2. Pillar II supervised DOTI Official 1 (Department of Transport and Infrastructure). The DOTI was later known as the Transport Sector of the UNMIK Directorate of Infrastructure Affairs. DOTI Official 1 left UNMIK at the end of June 2002. DOTI Official 2 was recruited by the DOTI as an international staff member on 31 July 2000 in charge of airport operations, reporting to DOTI Official 1, and continued in this role until 30 September 2001. Engineering expertise was provided by a series of engineers seconded from the armed forces of a United Nations member state, specifically Airport Engineer 1, Airport Engineer 2, and Airport Engineer 3, and later by a consultant from the Consulting Company.

On 1 July 2002, the responsibility for the administration of the Airport passed from Pillar II to the Kosovo Trust Agency (KTA) and Pillar IV. The Divisional Manager was appointed. Under him were the PEAP Official and ATCS Official (Air Traffic Control Services).

On 1 April 2004 Pristina International Airport, which had until that time been under the jurisdiction of KFOR was handed over to civilian jurisdiction, under ICAO regulations.

It is against this background of change that procurement procedures relating to the following contract have been examined."""
10.pdf,"""METHODOLOGY

This investigation was conducted pursuant to Executive Decision No 2003/16 on the establishment of the Investigation Task Force. The ITF investigators conducted an enquiry into the allegations raised by interviews with persons indicated to be witnesses and persons potentially implicated in the allegations; by obtaining documents from the Pristina Airport administration and from Pillar IV, which were then analysed for relevance to the inquiry at hand.

BACKGROUND INFORMATION

Pristina International Airport constitutes a state owned enterprise under Yugoslavian law. The assets of the airport include the runways, terminal buildings, hanger, fuel storage facilities and equipment. During the period covered by this investigation, from 2001 until 2003, they were maintained by the Public Enterprise Airport Pristina, (PEAP) in cooperation with Military Units of the Kosovo Force (KFOR). Pursuant to United Nations Security Council Resolution 1244 dated 10 June 1999, and UNMIK Regulation No 1/1999 dated 25 July 1999. UNMIK is mandated to administer the territory of Kosovo, including state owned and publicly owned assets. This includes Pristina International Airport."""
10.pdf,"""Allegation 4:

(Specifically, that the Vendor produced its own test results to confirm the quality of its own work on the Cargo Apron, resulting in a conflict of interest.)

An interoffice memorandum from Staff member 2 to the Procurement Official, signed by DOTI Official 1 dated 18 October 2001, indicates that DOTI Official 1 authorised the soil stabilisation work. The memorandum also adds that the work was inadvertently not included in the original contract.

DOTI Official 2 told the ITF that in order to progress the cargo apron tender, he/she had to organise a geographical survey. He/she added that only after the tests were done could the tender go ahead. However, the evaluation report at paragraph 4 suggests that information on the nature of the ground does not appear to have been included in the tender documents. In addition, a letter from the Vendor to UNMIK and PEAP dated 27 June 2001, but apparently not received at UNMIK and PEAP until 17 October 2001, according to a manuscript note signed by Airport Engineer 1 at the bottom of the letter, suggests that it carried out its own soil tests."""
10.pdf,"""DOTI Official 2 explained that the technical details of the Cargo Apron extension project were taken from the cargo terminal study produced by the Evaluation Company and pasted into the tender document specifications. Thereafter, it was up to the company winning the tender to demonstrate that they could fulfil the specification.

According to DOTI Official 2, Airport Engineer 1, who arrived shortly after the tender had been launched, had been angry with the Evaluation Company for allowing DOTI Official 2 to send out excerpts of their study as the tender specifications. Airport Engineer 1 had also expressed concern at the method used for preparing the tender documents, as from an engineering point of view the tenders did not contain sufficient detail. However, DOTI Official 2 stated that if the Evaluation Company had been asked to prepare the tender documents, it would have cost more money. He/she had therefore prepared the tender documents himself/herself and sent them to a Procurement Official at the CPE to review and help him with the procurement exercise.

Assistance from the CPE was provided primarily by a CPE Procurement Officer, and to a lesser extent by the Procurement Official, as to the procurement documents and rules. However, DOTI Official 2 expressed the view that neither the Procurement Official nor the CPE Procurement Officer would have had the technical expertise or time to review the technical specifications.

DOTI Official 2 emphasised that there was no engineering expert to support his/her work at the time the tender was launched, a fact that made his/her work very difficult."""
10.pdf,"""DOTI Official 2 is primarily responsible for the shortcomings in the tender documents although, DOTI Official 1 and the CPE must also bear a certain amount of responsibility.

The shortcomings in the tender documents are likely to have prejudiced some companies in their decision as to submitting bids for the tenders, since they may not have been clear as to the detailed requirements of the tender and therefore submitted insufficient detail in their bids as a result.

Three persons are indicated to have both attended the bid opening session as well as been on the tender evaluation committee, in conflict with UN regulations.

Evidence indicates the contract for the Cargo Apron Extension was not channelled through the Office of the Legal Adviser.

Evidence indicates that the Vendor produced its own bearing capacity report for the Cargo Apron, thereby “self certifying” its own work and presenting a potential conflict of interest."""
105.pdf,"""Description

This is a Secret US National Security Agency (NSA) report derived from intelligence intercepts of officials  within  the  Japanese Ministry  of Economy, Trade  and  Industry  and  the  Ministry of  Foreign Affairs,  shortly before the official visit of Japanese Prime Minister Shinzo Abe to Washington DC, for talks with President George W Bush. Abe's government is reported to have been considering not informing the United States of the Prime Minister's plan to reduce carbon emissions, on the basis that the plan might be opposed by the  Bush  administration. As  the  report  shows,  the  National  Security Agency  was  aware  both of the plan not to inform the United States, and of the government's change of mind, which was taken at a briefing at the Prime Minister's official residence."""
105.pdf,"""Japanese to State Goal of Reducing Carbon Emissions by Half by 2050 
(S//SI//NF)

(S//NF) In preparing for the 26 to 27 April visit to Washington by Japanese Prime Minister Shinzo Abe, the Japanese Ministry of Economy, Trade, and Industry (METI) apparently wanted to come up with a simple message regarding climate change with which the U.S. can agree. Accordingly, METI has pushed three principles: technical development, energy conservation and nuclear energy, and participation of all countries in the future framework. Meanwhile, the Ministry of Foreign Affairs (MFA) apparently wants Abe to mention at the bilateral summit Japan's goal of reducing carbon emissions by half by 2050 as part of the ""Abe initiative,"" which will be announced in late May. The MFA was considering not informing the U.S. in advance of its intention, because the ministry did not expect Washington to approve of such a goal, based on the U.S. reaction to climate change issues so far. It was apparently decided at a briefing at the Prime Minister's official residence that Abe will clearly state the goal at the bilateral summit, with advance notification to the United States. Japan anticipates no major harm to the Japanese­U.S. relationship as a result. "
106.pdf,"""Tokyo's Climate Change Officials to Continue Promoting Sectoral 
Approach (TS//SI//NF)

(TS//SI//NF) Japanese climate change officials apparently plan to continue promoting the sectoral approach despite criticism from the International Energy Agency (IEA) and some European Union officials. Fatih Birol, Chief Economist of the IEA, reportedly warned the Japanese in mid­-May that they are pushing too hard to promote the sectoral approach and may be perceived as offering this approach as the only option for reducing carbon emissions. He also cautioned that the sectoral approach is not yet understood and that Tokyo must clarify the concept and promote understanding and trust among the nations concerned. Masakazu Toyoda of the Japanese Ministry of Economy, Trade, and Industry expressed frustration at this criticism then laid out three advantages of the sectoral approach: first, the approach is designed to get China, India, and the U.S. on board; second, this approach allows developed countries to avoid expending unnecessary efforts to reduce carbon emissions in areas covered by the sectoral approach; and third, the sectoral approach will, in Toyoda's estimation, not result in any economic or industrial loss for developed or developing nations. One Japanese official thinks that it may be difficult for the Europeans to implement the sectoral approach in sectors such as electricity, which is already subject to the Emissions Trading Scheme (ETS). He suggested that the ultimate solution is dependent upon the EU accepting a method of determining a figure for total carbon emissions reductions that includes the electricity sector. Toyoda claimed that businesses from several sectors  ­including steel, aluminum, cement, and petroleum­­are threatening to cease their European operations if the ETS continues as is."
107.pdf,"""Description

This is a secret US National Security Agency (NSA) report derived from intelligence intercepts of officials within the Japanese government, shortly before 2008 G-8 Summit held in Lake Toya in Japan. The report observes a widespread impetus within the Japanese government, involving multiple ministries, towards Japanese leadership at the G-8 summit on policy to combat climate change, focusing on a Japanese initiative towards the ""sectoral approach"" to reducing carbon emissions. The report is marked for sharing with the United States' ""Five Eyes"" intelligence partners: Australia, Canada, Great Britain and New Zealand.

Japanese Leadership Working to Narrow Down Climate Change Goals for G­8 Summit (TS//SI)

(TS//SI//REL TO USA, AUS, CAN, GBR, NZL) Japanese officials from the Ministry of Economy Trade and Industry, Ministry of Foreign Affairs, Ministry of Finance, and Ministry of Environment briefed Chief Cabinet Secretary Nobutaka Machimura on 20 February on the environmental goals they believe Japan should work toward achieving at the G­8 Summit at Lake Toya, Japan, in July. Obtaining an agreement to use a sector-­based cumulative approach for medium-­term emissions reduction targets for individual countries was mentioned as one of the key objectives. Japan is also seeking to demonstrate its leadership in the environmental sector at the Summit and may announce its domestic emissions reduction goals prior to the meeting."""
108.pdf,"""Japanese Strive to Avoid Damage to U.S. Relations Over Cherry Imports (TS//SI//OC/NF)

(TS//SI//OC/NF) Officials in the Japanese Ministry of Agriculture, Forestry, and Fisheries (MAFF) appeared recently to be seeking ways to prevent damage to relations with the U.S. over the ministry's decision to delay the importation of U.S.-­origin cherries, a decision driven by Japanese politicians and growers. MAFF was alarmed by the very strong reaction of the U.S. Department of Agriculture to Tokyo's ruling that imports could not commence until the end of this month, when a pilot program involving inspections in the U.S. Pacific Northwest by a MAFF inspector is expected to be concluded satisfactorily. One approach under consideration is to have the ministry admit to Washington, through back channels, that the decision had been the product of political pressure. Also, it was recommended that the U.S. be notified that­­unlike in the beef dispute­­imports could begin as soon as the result of on­site inspection is confirmed, rather than after the inspector had returned to Japan and more tests conducted. The principal fear among the Japanese is that the issue will become similarly politicized, possibly at senior levels, in Washington. 

Unconventional 

Japanese governmental  

Z­3/OO/515570­09, 221708Z"""
108.pdf,"""Description

This  is  a  Secret  US  National  Security Agency  (NSA)  2009  report  derived  from  intelligence  intercepts  of officials within the Japanese Ministry of Agriculture, Forestry and Fisheries. The report indicates that the National  Security  Agency  knew  of  the  options  under  consideration  within  the  Ministry  for  how  Japan should seek to patch up bilateral relations with the US over a trade dispute concerning the import of US cherries. Among  the  options  being  discussed  were  the  use  of  back  channels  to  share  information  with Washington. The report indicates that the main Japanese incentive is the avoidance of politicization of the trade issue in Washington."""
11.pdf,"Until the end of June 2002, responsibility for the administration of the Pristina Airport was entrusted to the Civil Administration Pillar (Pillar II) of UNMIK, including Official 1 and Official 2. Pillar II supervised the Department of Transport and Infrastructure (DOTI) Official 1. The DOTI was later known as the Transport Sector of the UNMIK Directorate of Infrastructure Affairs. DOTI Official 1 left UNMIK at the end of June 2002. DOTI Official 2 was recruited by the DOTI as an international staff member on 31 July 2000 in charge of airport operations, reporting to DOTI Official 1, and continued in this role until 30 September 2001. Engineering expertise was provided by a series of engineers seconded from the armed forces of a United Nations member state, specifically Airport Engineer I, Airport Engineer 2 and Airport Engineer 3, and later by the Consultant from the Consulting Firm. On 1 July 2002, the responsibility for the administration of the Airport passed from Pillar II to the Kosovo Trust Agency (KTA) and Pillar IV. The Divisional Manager was appointed at the Airport Sector, KTA at the same time. Under him were the PEAP Official and the Air Traffic Control Services (ATCS) Official. On 1 April 2004 Pristina International Airport, which had until that time been under the jurisdiction of KFOR was handed over to civilian jurisdiction, under ICAO regulations. It is against this background of change that procurement procedures relating to the following contract have been examined."
11.pdf,"METHODOLOGY This investigation was conducted pursuant to Executive Decision No 2003/16 on the establishment of the Investigation Task Force. The ITF investigators conducted an enquiry into the allegations raised by interviews with persons indicated to be witnesses and persons potentially implicated in the allegations; by obtaining documents from the Pristina Airport administration and from Pillar IV, which were then analysed for relevance to the inquiry at hand. This report details the findings resulting from these enquiries. BACKGROUND INFORMATION Pristina International Airport constitutes a state owned enterprise under Yugoslavian law. The assets of the airport include the runways, terminal buildings, hanger, fuel storage facilities and equipment. During the period covered by this investigation, from 2001 until 2003, they were maintained by the Public Enterprise Airport Pristina, (PEAP) in cooperation with Military Units of the Kosovo Force (KFOR). Pursuant to United Nations Security Council Resolution 1244 dated 10 June 1999, and UNMIK Regulation No 1/1999 dated 25 July 1999, UNMIK is mandated to administer the territory of Kosovo, including state owned and publicly owned assets. This includes Pristina International Airport."
110.pdf,"The EU and Japan were engaged as of early December in strategy sessions aimed at a common handling policy to deal with potential U.S. moves in the Doha Round negotiations. There was a conviction in both Brussels and Tokyo, according to Japanese reporting, that great care must be taken to avoid falling prey to U.S. moves designed to extort concessions through exaggerated initial demands. Regarding U.S. domestic supports for agriculture, for example, Japanese Minister of Agriculture, Forestry, and Fisheries Toshikatsu Matsuoka and EU Agriculture Commissioner Marianne Fischer-Boel recently pondered whether to jump-start the negotiations by asking the U.S. for a specific dollar figure in reduced supports. The problem for the EU, it was noted, is whether or not the proposed $17 billion mark is an acceptable point of departure, since U.S. supports at that level are judged to be in no way comparable to the breadth of market access that Brussels put on the table last July. A figure of $14 to $15 billion would be more in line with the EU's thinking, Fischer-Boel indicated. The EU also had concerns that Washington may be headed for a showdown with developing countries over special products. As for sensitive products, Fischer-Boel's deputy chef de cabinet, Klaus-Dieter Borchardt, hinted to the Japanese that the EU may be willing to go lower than its current official limit of 8 percent, possibly as low as 4 to 5 percent; however, that would be hard for Japan to accept. Borchardt also tried to allay Japanese fears that the EU might try again to enter into a bilateral, under-the-table deal with the U.S. (as had happened in Cancun in 2003), saying that Brussels had learned its lesson with respect to such back-door actions."
