PDF Path,Text
47.pdf,"""III. INVESTIGATIVE DETAILS

The charges themselves, as calculated by the Airport Handling Services Department for Airline flights, were scrutinized against the published ""Price List for Basic Airport Services"" issued on 1 January 2002.

Details recorded on the ""Load Sheets"" confirmed the handling charge of 1074 Euros was also found to be correct. The landing charge of €676.44 was, however, reduced by 50% as this flight was identified as a ""humanitarian flight"" and as such qualified for the discount. The Official of the Passenger Handling Services, Pristina Airport told the ITF Investigators that she regarded the returning Kosovars as refugees and the discount as appropriate. The ITF Investigators checked this matter with the Official of the Airport General Services, who confirmed he/she was aware of this discount and did not dispute this interpretation of the flight."""
47.pdf,"""IV. FINDINGS AND CONCLUSIONS

There is no evidence that the Airline have sought to avoid any charges levied by Pristina Airport. All charges levied upon the Airline by Pristina Airport for incoming and outgoing flights have been paid and receipts issued. The charges applied to the Airline flights are in accordance with listed charges for services.

The identification of the flight as ""humanitarian"" is a matter for closer review by Airport Pristina management to ensure compliance with airport charges.

The recently appointed Senior Official of the Pristina Airport, when advised by the ITF of the number of cash transactions, was unaware that this practice continued within the Passenger Handling Services Department.

The information as to a credit arrangement for the Airline was also provided to the Pristina Airport Senior Official by the ITF for his/her action.

The charges shown in the ""Price List for Basic Airport Services"" correspond with those charged to the Airline. In addition, the audit trail in respect of the cash handling receipts, recording, and reconciliation with the cashbooks and airport’s records showed no discrepancies."""
47.pdf,"""III. INVESTIGATIVE DETAILS

The ITF reviewed the conventional check-in procedures at the Pristina Airport and confirmed they complied with observations provided by the Senior Official of the Pristina Airport in response to a Management Letter dated May 2004 on the 2003 Financial Audit from auditing company. An extract of the advice states the following:

Management Comment: Full integration will be achieved by the new system. At present, passenger and baggage check-in and boarding is automatically connected to the load sheet. The load sheet contains all relevant facts concerning the flight, including type and quantity of passengers. This report is signed by Airport load control staff, compared to a head-count on board the aircraft conducted by aircraft staff and is thereafter signed by the pilot before take-off. A copy of this confirmed report is used as a basis for invoicing. We use the information that later will be retrieved automatically by the new system.’

The possible loss of revenue of departing passenger taxes is another matter requiring attention from airport management."""
47.pdf,"""III. INVESTIGATIVE DETAILS

The ITF reviewed the conventional check-in procedures at the Pristina Airport and confirmed they complied with observations provided by the Senior Official of the Pristina Airport in response to a Management Letter dated May 2004 on the 2003 Financial Audit from auditing company. An extract of the advice states the following:

53. Passenger Fees
OBSERVATION
In the process of modernization of the Airport, Entity has acquired and implemented a so-called automatic checking system. This system provides accurate evidence of passengers’ arriving and departure. However, PA has still not integrated and/or connected the automatic checking system with financial reporting

54. Establishment of an integrated system could provide efficient monitoring controls and accurate evidence, completeness and reconciliation of the number of passenger recorded by the automatic checking system and the revenue from passenger fees in the financial statement."""
47.pdf,"""III. INVESTIGATIVE DETAILS

ITF Investigators asked the Official of the Passenger Handling Services, Pristina Airport to describe the airport tax obligations for such flights. The Official stated that the tax of €15 per passenger is payable in respect of departing passengers only. The Official explained that this tax is normally collected by the airlines using the check-in facilities as part of normal boarding procedures. He/She explained that the security guards and U.K. Immigration staff who remained airside awaiting return to the UK had not technically entered the Airport and as such were not liable for airport taxes. In respect of the other departing passengers, the Official said there was no obligation for the payment of this tax because neither the carrier nor the passengers used the regular check-in facilities of the Airport."""
47.pdf,"""III. INVESTIGATIVE DETAILS

Other passengers departing with the Airline met in the Airport public lounge. Their identities were checked against a list provided by an UNMIK CIVPOL officer in consultation with the Immigration representative. They then went through conventional immigration and X-Ray searches and were escorted into the departure lounge before boarding the Airline aircraft. They did not, however, pass through regular check-in procedures at any time.

ITF Investigators reviewed all paperwork relating to this flight. An Official of the Passenger Handling Services, Pristina Airport, provided the receipt book used to evidence cash payments for landing, handling and airport passenger taxes. It was noted that other airlines, particularly those not visiting Pristina on a regular basis, pay in cash for handling services.

Details shown on the records provided by Pristina Airport officials were reconciled with this receipt book. The dates, amounts and breakdown of charges were confirmed. The pilot is required to sign the receipt book, and the ITF verified the recorded signature against the Airline ""Load Sheets"" as genuine."""
47.pdf,"""III. INVESTIGATIVE DETAILS

Airline Official 1 explained that the Airline paid cash for handling and landing charges to the Pristina Airport Passenger Handling Services Department on each occasion his aircraft used the airport. Airline Official 1 explained that he/she had endeavored to open a credit account with Pristina Airport, but without success.

The ITF sought the assistance of the Security Officer at Pristina Airport, in order to monitor Airline passenger movements. On 22 July 2004, ITF Investigators monitored the Airline’s inward and outward flights and related airport activities. It was noted that whilst the arriving Kosovar passengers went through immigration procedures before entering into the arrivals lounge, the 25 security escorts and the representative of the related Immigration Department remained airside at all times awaiting instructions to return to the aircraft. They did not enter the terminal building."""
47.pdf,"""III. INVESTIGATIVE DETAILS

ITF Investigators obtained a number of documents from Pristina Airport officials including records of funds received from the Airline for the period January to June 2004. These funds are broken down into handling, landing, airport passenger, and departure tax. The schedule also lists the individual Airport receipt number recorded for each cash payment. There was no record of the Airline having paid airport tax.

ITF Investigators spoke to both Official 1 and Official 2 of the Airline and requested copies of receipts issued by Pristina Airport in respect of fees paid by the Airline to the airport, as well as the Aircraft ""Load Sheets"" for May and June 2004. These documents record details such as the weight of the aircraft including the MTOW (maximum take off weight)."""
47.pdf,"""II. BACKGROUND INFORMATION

The Airline flies to Pristina Airport from a European Airport every Thursday carrying Kosovar passengers who have been found to enter the referred European state illegally. The Airline is contracted with the foreign state’s Immigration Department. A representative of the Immigration Department and 25 or more ""Securicor"" security staff routinely escort the passengers on the flights to Pristina.

On the return leg to the mentioned state, the Airline flight carries passengers from Pristina, consisting of the returning Securicor escorts, the representative of Immigration, and in addition, a number of police officers of the concerned state currently working for UNMIK CIVPOL. These CIVPOL officers travel to the UK without payment, but with the knowledge and approval of both Airline and the U.K. Immigration Department."""
49.pdf,"""ITF investigators visited the Border Boundary Police and interviewed two current investigators. Neither officer recalled the incident, but they made extensive enquiries in an attempt to trace the police report and locate the €5,200. They were unsuccessful on both counts.

On 27 September 2004, the ITF sent a letter to UNMIK Police Officer 2, in an effort to determine what investigations had been undertaken into the matter, the result of those investigations, and the whereabouts of the money.

The UNMIK Police Officer 2 indicated that Regional Crime Squad Pristina Region was undertaking an investigation into the matter, which therefore remains an open investigation."""
49.pdf,"""INVESTIGATION DETAILS

Analysis of the note written by the PEAP Official suggests that the company referred to in his note as “escavator” is in fact Company 1, who won the contract for the construction of the new car park at Pristina Airport and whose representative attended a meeting in the PEAP Official’s office one day prior to the discovery of the money.

The sum of €5,200 alleged to have been left in the envelope is unusual, since one would expect the sum to have been a “round sum” such as €5000.

It should be noted that an interoffice memorandum from a former Airport Engineer to the KTA Procurement Specialist, dated 26 September 2002, alleged that the PEAP Official had accepted an open envelope of documents relating to the car park tender from Company 2, after the time for submission of bids had concluded and contrary to accepted procurement procedures on the handling of bids. (This allegation is addressed in ITF Case No. 0274/04)"""
49.pdf,"""INTRODUCTION

On 29 April 2004 a Divisional Manager, UNMIK Pillar IV, alleged that in October 2002, an envelope containing €5200 was left in the office of an official of Public Enterprise Airport Pristina (PEAP), by an unidentified individual. On 4 October 2002, a group of approximately 8 persons, including a KTA Procurement Specialist and Company 1 representative, had attended a meeting in his office concerning a procurement contract for the building of a new car park at Pristina International Airport.

APPLICABLE TERRITORIAL LAWS AND UNITED NATIONS PROCEDURAL RULES

This case concerns an allegation of attempted bribery and corruption as cited in
Article 344 of the Provisional Criminal Code of Kosovo."""
49.pdf,"""BACKGROUND INFORMATION

On 29 April 2004, the Divisional Manager advised the ITF of an incident which had occurred “sometime in October 2002”, which he/she “thought” he/she had raised with the ITF previously. However, no evidence of this report could be located nor recalled by any members of the ITF.

The Divisional Manager provided the ITF with a copy of documents passed to an UNMIK police officer, on 11 October 2002 at UNMIK Police in Fush, Kosovo, concerning the incident.

The documents consist of a letter from the Divisional Manager to the UNMIK Police Officer dated 11 October 2002, and a file note from the PEAP Official, dated 8 October 2002, to the Divisional Manager, detailing the incident and annexing a list of serial numbers of Euro notes totalling €5,200 alleged to have been left in the PEAP official’s diary in his office."""
49.pdf,"""The KTA Procurement Specialist also indicated that he/she did not see anything placed in the PEAP Official’s office or diary, although he/she later heard about the incident. He/she expressed his/her opinion that the incident had been arranged to “break up” the contract with Company 1 but did not indicate by whom.

The ITF reviewed the letter from the Divisional Manager to the UNMIK Police Officer, which indicates that the matter was referred to the UNMIK police on 11 October 2002. The letter also records that the sum of €5,200 was handed to the UNMIK Police Officer.

The UNMIK Police Officer, who is now based in Iraq, told the ITF that he/she served in Kosovo between June 2001 and November 2002 and recalls the incident being reported. He/she stated that at that time he/she was serving with the Border Police Investigations Unit and had assigned this enquiry to his then supervisor. The latter was unable to be interviewed as he/she had left the Mission."""
49.pdf,"""The KTA Procurement Specialist told the ITF that a meeting had been held in the PEAP Official’s office with Company 1, attended by the Company 1 Representative and a Company 1 engineer. The purpose of the meeting had been to hand the contract for the new car park to Company 1 and the Company 1 Representative to sign it. The KTA Procurement Specialist indicated that there were three or four other persons present, two of whom, he/she thought may be two staff members of Pristina Airport. The KTA Procurement Specialist added that it was normal practice for the party winning the bid to be invited to sign the contract in this way."""
5.pdf,"METHODOLOGY

This investigation was conducted pursuant to Executive Decision No 2003/16 on the establishment of the Investigation Task Force. The ITF investigators conducted an enquiry into the allegations raised by interviews with persons indicated to be witnesses and persons potentially implicated in the allegations; by obtaining documents from the Pristina Airport administration and from Pillar IV, which were then analysed for relevance to the inquiry at hand.

BACKGROUND INFORMATION

Pristina International Airport constitutes a state owned enterprise under Yugoslavian law. The assets of the airport include the runways, terminal buildings, hanger, fuel storage facilities and equipment. During the period covered by this investigation, from 2001 until 2003, they were maintained by the Public Enterprise Airport Pristina, (PEAP) in cooperation with Military Units of the Kosovo Force (KFOR). Pursuant to United Nations Security Council Resolution 1244 dated 10 June 1999, and UNMIK Regulation No 1/1999 dated 25 July 1999.
UNMIK is mandated to administer the territory of Kosovo, including state owned and publicly owned assets. This includes Pristina International Airport.

Until the end of June 2002, responsibility for the administration of the Pristina Airport was entrusted to the Civil Administration Pillar (Pillar II) of UNMIK, including Official 1 and Official 2. Pillar II supervised the Department of Transport and Infrastructure (DOTI) Official 1. The DOTI was later known as the Transport Sector of the UNMIK Directorate of Infrastructure Affairs. DOTI Official 1 left UNMIK at the end of June 2002. DOTI Official 2 was recruited by the DOTI as an international staff member on 31 July 2000 in charge of airport operations,
reporting to DOTI Official 1, and continued in this role until 30 September 2001. Engineering expertise was provided by a series of engineers seconded from a member state’s armed forces specifically Airport Engineer I, Airport Engineer 2 and Airport Engineer 3, and later by the Consultant from the Consulting Firm

On 1 July 2002, the responsibility for the administration of the Airport passed from Pillar II to the Kosovo Trust Agency (KTA) and Pillar IV. The Divisional Manager was appointed at the Airport Sector, KTA at the same time. Under him/her were the PEAP Official and the Air Traffic Control Services (ATCS) Official 1.

On 1 April 2004 Pristina International Airport, which had until that time been under the jurisdiction of KFOR, was handed over to civilian jurisdiction, under ICAO regulations.

It is against this background of change that procurement procedures relating to
the following contract have been examined."
51.pdf,"""IV. CRIMINAL VIOLATIONS

Based on the referral from the ITF to the Department of Justice on 26 July 2004, arrest warrants were issued against Official 1 and Official 2. Each charge is detailed below:

Count 1

That between the dates 14th March 2004 and 16th March 2004 inclusive, Official 1 and Official 2 acting in their capacity as officials of Airport Pristina, and acting in complicity with the intention to obtain an unlawful material benefit, presented a representative of the Company with a false statement of account claiming reduced storage fees, and in so doing, misled an authorized person to carry out an unlawful payment, thereby committing the offence of Fraud in Service in violation of Article 215, (1) and (2) of the Kosovo Criminal Code (KCC) punishable by imprisonment of one to ten years

{equivalent to Fraud in Office contrary to Article 341 (1) and (2) of Provisional Kosovo Criminal Code (PCCK)};

and Complicity, in violation of Article 22 of Criminal Code of SFRY,( equivalent to Co- Perpetration, in violation of PCCK Article 23)"""
51.pdf,"""III. INVESTIGATIVE DETAILS

On the 16th of March 2004, Partner 1 paid the €8,000.00 to the Company Representative, who then went to Pristina Airport to hand it to Official 1. The Company Representative stated that the hand-over of the cash to Official 1 took place outside the airport terminal gate. The Airport X-Ray Operator, who observed the meeting between the two men, corroborated the fact that the meeting took place as stated.

ITF Investigators visited the Cargo Department Finance Office to check official documentation in relation to the Company merchandise. No trace of the payment of the €8,000 could be found in the Cargo Department account books for 2003 or 2004.

According to the tariff list that the Finance Officer of the Cargo Section provided to the ITF, the Company should have paid an amount of approximately €32,000.00 for storage fees from the 23rd of December 2003 to 15th of March 2004."""
51.pdf,""" II. Background

ITF Investigators met with the Company Representative, who explained that a part of his business involves the importation and marketing of LED display equipment. The Company consists of 4 partners:
• Partner 1
• Partner 2
• Partner 3
• Partner 4

The above company partners agreed to the following regarding the various payments to be effected as follows:
• Partner 2 and Partner 3 were to pay the total price of all the goods;
• Partner 1 was to pay everything regarding VAT, Custom Duties, Local Taxes and Storage.

III. THE DUTIES AND RESPONSIBILITIES OF AIRPORT PRISTINA CARGO OFFICIALS

It was Official 2’s responsibility to ensure that storage fees were paid and a record of the payments be kept. The procedure for recording payments is that the airway bill with a customs stamp should have been provided to the Finance Officer whereby he/she then calculates the storage fees owed. Before individuals or companies were allowed to retrieve their goods, this fee had to be paid pursuant to an official invoice. In this instant case, there is no record of such an invoice or any such payment. The absence of such a record is highly unusual and establishes that monies owed to the airport were not received in this case.

Official 1 worked in the Cargo Handling Office at the Airport. As with Official 2, it was Official 1’s duty to ensure that all payments made by customers of the airport complied with the applicable regulations and instructions."""
52.pdf,"""APPLICABLE TERRITORIAL LAWS:

Pursuant to the authority given to The Special Representative of the Secretary-General, under United Nations Security Council Resolution 1244 (1999) of 10 June 1999, taking into account United Nations Interim Administration Mission in Kosovo (UNMIK) Regulation No. 1999/1 of 25 July 1999 on the Authority of the Interim Administration in Kosovo, for the purpose of defining the law applicable in Kosovo, the SRSG promulgated that the law applicable in Kosovo shall be:
a. The regulations promulgated by the Special Representative of the Secretary-General and subsidiary instruments issued thereunder; and

b. The law in force in Kosovo on 22 March 1989.

The ITF Investigators considered possible breaches of the Provisional Criminal Code of Kosovo, especially Article 339 (Abusing Official Position of Authority); Article 340 (Misappropriation in Office); and Article 341 (Fraud in Office)."""
52.pdf,"""INTRODUCTION

The Investigation Task Force (ITF) Kosovo conducted an investigation into the circumstances surrounding a UNMIK Bank Account opened at a Bank in Pristina. This investigation was triggered by a forensic audit report of Public Enterprise Airport Pristina (PEAP) released in February 2003 by the Chartered Accountants.

The activities of the Pristina Airport fall under the control of the Kosovo Trust Agency (KTA) and UNMIK Pillar IV, which is administered by the European Union. Investigations into allegations of fraud and corruption involving UNMIK, its pillars, and other organisational structures, as well as the Provisional Institutions of Self-Government (PISG) and independent bodies and offices established pursuant to the Constitutional Framework for Provisional Self-Government in Kosovo, fall within the purview of ITF as laid out by the Executive Decision on the Establishment of the Investigation Task Force UNMIK/ED/2003/16, dated 21 October 2003."""
52.pdf,"""BACKGROUND INFORMATION

The DCDM Audit Report 2002/3 highlighted a possible problem with a UNMIK Bank Account, which has been termed the “Company Account”. It was alleged that there was only one signatory to this account (Staff Member 1) and that the interest from this account was going to an unidentified private account.

INVESTIGATIVE DETAILS

The ITF Investigators established that on 13 and 20 July 2001, UNMIK and the Company signed a contract “Relating to the Supply of Aviation Fuel and the Refueling of Commercial Civilian Aircraft at Pristina Airport”. As of 03 March 2004, this Contract was amended, so that the Company also commenced supplying aviation fuel and refueling services to military and non-commercial aircraft."""
60.pdf,"""ALLEGATIONS OF CONFLICT OF INTEREST AND ABUSE OF AUTHORITY BY SENIOR OFFICIAL 1, UNMIL

The Investigations Division of the Office of Internal Oversight Services (ID/OIOS) received information that a Senior Official for the United Nations Mission in Liberia (SRSG UNMIL) was involved in business dealings with a businessman operating in Liberia, and had abused his authority UNMIL to the benefit of either himself or of the businessman.

The evidence adduced by the investigation, does not support the allegations. The ID/OIOS investigation found no evidence that the Senior Official was involved in business dealings with the businessman, nor that he had abused his authority to the benefit of either himself or of the businessman."""
63.pdf,"""II. BACKGROUND INFORMATION

UNMIL was established on 19 September 2003 by Security Council Resolution 1509. Officer 1 was responsible for establishing the UNMIL Fuel Cell at the start of the mission, having previously served as an Officer with the Mission des Nations Unies au République Démocratique de Congo (MONUC). During the time he served as an officer of the UNMIL Fuel Cell, the unit consisted of himself and 20 other staff members (four International staff and the remainder National staff). Officer 1 left UNMIL and the United Nations on 30 June 2004. His replacement, Officer 2, took over the post on 8 July 2004.

In January and February 2004 an audit of ""Fuel Management in UNMIL"" (Reference AP2004/626/05) was conducted by IAD1/OIOS."""
69.pdf,"INTRODUCTION
On 13 February 2005, the Investigations Division of the Office of Internal Oversight Services (ID/OIOS) received a request from UNON Official 1 to inquire into allegations that locally recruited United Nations Office at Nairobi (UNON) staff may have engaged in improper conduct by submitting fraudulent letters of appointments showing longer contract duration dates to obtain loans from the United Nations Co-operative Savings and Credit Society Limited (UN-SACCO), which operates within UNON premises. The request was prompted by an earlier report submitted to UNON Management by UNON Official 2, on a scheme whereby locally recruited staff members from the Nairobi-based United Nations Children’s Fund/Somalia Support Centre (UNICEF/Somalia) obtained UN-SACCO loans by submitting fraudulent letters of appointments to UN-SACCO. The primary concern of UNON Management was that a similar fraudulent scheme might have spread to UNON and other Nairobi based United Nations Agencies."
